Name,Price,Quantity,Unit
Agua Mineral SAN MATEO Sin Gas Bidón 7,8.30,7,l
Gaseosa COCA COLA Sin Azúcar Botella 300ml Paquete 6,10.00,6,un
Gaseosas INCA KOLA Sabor Original 2 Botellas 3L + Gaseosa COCA COLA Sabor Original Botella 3,29.50,3,l
Gaseosa COCA COLA Sin Azúcar 2Pack Botella 1.5,11.90,1.5,l
Gaseosa COCA COLA + INCA KOLA 2Pack Botella 3,19.90,3,l
Agua de Mesa SAN LUIS Sin Gas Bidón 7,7.50,7,l
Agua sin Gas CIELO Bidón 7,7.50,7,l
Agua con Gas SAN LUIS Sabor a Manzana Botella 625ml Paquete 6,11.00,6,un
Agua sin Gas BELL'S Bidón 7,5.60,7,l
Pack Gaseosa COCA COLA sin Azúcar Botella 1.5L + Gaseosa INCA KOLA sin Azúcar Botella 1.5,11.90,1.5,l
Pack Agua SAN LUIS sin Gas Caja 20L Paquete 2,46.00,2,un
Agua sin Gas CIELO Botella 2.5L Paquete 6,14.00,6,un
Agua de Mesa SAN CARLOS Sin Gas Caja 20,19.20,20,l
Agua de Mesa SAN CARLOS sin Gas Botella 500ml Paquete 20,12.90,20,un
Gaseosa INCA KOLA Sin Azúcar Botella 300ml Paquete 6,10.00,6,un
Gaseosas COCA COLA Sabor Original 2 Botellas 3L + Gaseosa INCA KOLA Sabor Original Botella 3,29.50,3,l
Gaseosa INCA KOLA + COCA COLA + FANTA Botella 3L Paquete 3,25.90,3,un
Gaseosa INCA KOLA Sin Azúcar Botella 1.5L Paquete 2,11.90,2,un
Agua Mineral SAN MATEO sin Gas Botella 2.5,3.00,2.5,l
Gaseosa COCA COLA Sabor Original Botella 3L Two Pack,19.90,1,un
