Name,Price,Quantity,Unit
Peluche KISSES PKST-1010 80cm,19.90,1,un
Juego De Mesa Mattel Games Uno No Mercy Hwv18,26.95,1,un
Set de Juego BARBIE Nueva Casa de los Sueños,879.00,1,un
Auto Negro BABY KINGDOM Bz1719-R,249.00,1,un
Micrófono Musical CHENGJUN TOYS 5830,19.90,1,un
Play Set Conejito FENG JIN TOYS 6678,19.90,1,un
Auto Rosado BABY KINGDOM Bz1719-R,249.00,1,un
Juego de Mesa CashFlow 101 - Robert T. Kiyosaki,43.90,1,un
Ultimate Garage HOT WHEELS City HKX48,599.00,1,un
Piano Electrónico BIGFUN 49 Teclas BF-530A1,39.90,1,un
Osito QIYILE Trolley A/S998-4,29.90,1,un
Motocicleta de Juguete BABY KINGDOM BZ1166 Rojo,119.00,1,un
Vehículo de Juguete BABY KINGDOM BR2101-R,139.00,1,un
Vehículo de Juguete BABY KINGDOM BH918 Blanco,229.00,1,un
Figura de Batalla POKEMON 95164 Gyrados,83.90,1,un
Juego de mesa MATTEL GAMES Uno Flip Juego De Mesa,26.90,1,un
Camión Sorpresa para Pista HOT WHEELS (Modelos Aleatorios),34.90,1,un
Moto Vintage Verde BABY KINGDOM J868-V,219.00,1,un
Play Set Garage Rojo XINHANG TOYS 17 Pcs,5.90,1,un
